62,43,64,56,Durham University Business School,UK,2017,"110,506","110,506",107,3,44,83,55,94 (90),93,34,57,38,69,95,75,44,40,1,98,91,7,,"Internationally accredited,  Durham University Business School is proudly integral to one of the world’s prestigious universities. Our vision is to lead business thought and practice to improve global wealth and well-being.",31,Y,Y,Y,Y,N,Y,Y,N,Y,Y,"Our mission is to develop and enthuse leaders and entrepreneurs who create,  share and use knowledge to deliver equitable and sustainable futures around the world.",25,N,N,N,N,N,N,N,Y,N,N,Y,Y,Y,N,N,Y,Y,"Inspiring By stimulating an instinct to challenge,  encouraging innovative thinking and taking our responsibilities seriously,  we foster a culture that inspires the extraordinary ,  Challenging Always curious,  we challenge ourselves and each other to answer the big questions and create a positive impact in the world, Innovative From creative teaching practices and cutting edge research to new ways of working,  innovation is at the heart of what we do, Responsible We take our duties as a centre of learning,  neighbour and employer seriously,  embracing all of our different communities and celebrating the differences that make us stronger together, Enabling We create the opportunities,  support and freedom for everyone at Durham to become the best they can be now,  and for the future",122,https://www.dur.ac.uk/business/about/mission-and-values/,
63,43,49,52,Singapore Management University: Lee Kong Chian,Singapore,2020,"115,039","115,039",125,45,89,87,73,69 (97),60,23,49,33,63,76,53,27,56,0,98,49,99,,"To be a world-renowned global city university,  tackling the world's complexities,  Impacting humanity positively.",14,Y,Y,Y,Y,N,Y,Y,N,Y,N,"We create business knowledge,  and nurture keen minds to lead organisations and serve society.This mission statement underscores two important aspects of the school's reason for being - that is,  we create and disseminate knowledge. With respect to the first,  we aspire to be recognized as a place where high quality,  scholarly research is undertaken. With respect to the second,  we strive not simply to impart business skills to our graduates,  but to also provide an environment that pushes them to excel and that cultivates their leadership potential. In addition,  we want to imbue in our graduates the sense of being part of a larger community and the consequent need to act in service of society.",115,Y,Y,Y,N,N,N,Y,Y,N,Y,N,Y,Y,Y,N,Y,Y,"INDUSTRY Strengthen industry engagement through a dedicated unit ,  INNOVATION Support all innovation and entrepreneurship activities through a university-level body, INTERNATIONALISATION Expand our international footprint and connections through like-minded partners and institutions and INTEGRATION
Develop more integrated OneSMU approaches in multiple activities and offerings",43,https://business.smu.edu.sg/business/about/our-history-and-mission   - https://www.smu.edu.sg/about/vision2025,
64,71,94,76,WHU – Otto Beisheim School of Management,Germany,2016,"125,238","125,238",84,25,61,90,45,78 (90),73,22,47,12,31,80,12,20,3,0,100,86,24,,"WHU is respected as an excellent player among the top European Business Schools with thought-leading impact on four target groups:
1) researchers,  2) students,  3) managers,  and 4) policymakers. 
WHU generates knowledge from independent,  high-quality research and from close connections between academics and the business community.",45,N,Y,N,N,N,N,Y,Y,Y,Y,"At WHU – Otto Beisheim School of Management,  we shape personalities and business by delivering excellence in research,  teaching,  and corporate connections",22, N,Y,N,N,N,N,Y,N,N,Y,Y,Y,Y,N,N,Y,N,".Our students embody the term ‘WHU Spirit’. Their intellectual,  cultural,  and social commitment can be seen in about 30 student clubs that impact Vallendar,  Düsseldorf,  Germany,  and the world. WHU pays particular attention to the core brand values excellence,  community,  cosmopoliteness,  and entrepreneurship. Our positioning ""We foster Courage and Commitment"" underpins these core values",52,https://www.whu.edu/en/about-whu/about-whu,
65,48,64,59,University of California at Irvine: Merage,US,2016,"135,170","135,170",113,68,85,89,32,71 (100),81,45,27,32,35,31,12,63,55,0,94,35,89,,To be at the forefront of education and research among globally preeminent business schools.,14,Y,Y,Y,Y,N,Y,Y,N,Y,Y,"Develop globally-competitive transformational leaders in a diverse,  collaborative,  student-centric community where academic excellence and practical application coalesce.",17,Y,Y,N,N,N,Y,Y,Y,N,Y,Y,Y,N,N,N,Y,Y,,0,https://merage.uci.edu/why-merage/strategic-plan.html,
66,55,37,53,"Rotterdam School of Management,  Erasmus University",Netherlands,2016,"115,375","115,955",76,43,48,86,90,88 (93),46,28,38,23,55,99,23,2,33,0,98,26,62,,for a better future,4,Y,Y,Y,Y,Y,Y,N,N,Y,Y,To be a force for positive change in the world.,10,N,N,N,N,Y,N,N,N,N,N,Y,Y,Y,Y,N,Y,Y,"critical,  creative,  caring and collaborative,  and is committed to the UN’s 17 Sustainable Development Goals as a framework for its mission.",21,https://www.rsm.nl/positive-change/our-mission/,
67,68,86,74,Boston University: Questrom,US,2018,"128,696","128,696",136,54,76,89,94,92 (90),51,35,46,13,31,46,56,61,90,0,72,44,18,,Creating Value for the World,5,Y,Y,Y,Y,N,Y,Y,N,Y,Y,"We prepare innovative and ethical leaders who understand the impact of business on society and create value for the world. Our students comprehend organizational systems,  the vital role of leadership,  and the forces transforming the global economy. We generate scholarly knowledge and insights that advance management practice through our research,  teaching,  and community engagement.",54,Y,Y,N,Y,N,Y,Y,Y,N,Y,Y,Y,N,Y,N,Y,Y,"We believe In truth,  the only foundation of success.In service,  the motive of business.In the golden rule,  the unchanging standard of conduct.In the consciousness of service performed,  the sufficient reward of endeavor.",32,https://www.bu.edu/questrom/about/,
68,69,60,66,University of St Gallen,Switzerland,2018,"127,022","127,022",73,15,50,89,54,83 (100),58,16,26,50,81,93,50,3,69,0,100,80,69,,"As a leading business university we set global standards for research and teaching by promoting integrative thought,  responsible action and an entrepreneurial spirit of innovation in business and society.",29,Y,Y,Y,Y,N,Y,Y,N,Y,Y,"We are striving to be the best business school in the German-speaking world when it comes to innovative teaching and research in the field of management education. Students are sure to find an attractive,  international learning environment that is relevant to research and practical applications. We actively promote the international character of the faculty and the students and cultivate a network of over 150 partner universities worldwide.",67,Y,Y,Y,Y,N,Y,Y,N,Y,Y,Y,Y,Y,N,Y,Y,Y,"driven,  collaborative,  proficient,  comprehensive",4,https://www.unisg.ch/en/universitaet/ueber-uns/vision/unsere-marke,
69,-,-,-,Northeastern University: D'Amore-McKim,US,2013,"107,350","107,350",159,64,99,86,24,90 (100),85,28,53,29,26,28,0,32,44,0,89,47,82,,"D’Amore-McKim will be widely recognized as a preeminent business school that generates impactful knowledge and develops leaders who will shape business in a landscape of digital convergence.By doing so,  we will become the school of choice for elite talent around the world.",42,Y,Y,Y,Y,N,Y,N,Y,N,Y,"Educate leaders and thinkers to be prepared for the future of work in a world being shaped by digital convergence,  we contribute use-inspired thought to the global business world that empowers companies to be prepared for this future and foster an inclusive culture of excellence that transforms lives.",48,N,Y,N,Y,N,Y,Y,N,N,Y,Y,Y,N,N,N,Y,Y,"Access,  excellence,  innovation,  focus on students,  and global vision",9,https://damore-mckim.northeastern.edu/defining-our-future-damore-mckim-2025/,
70,90,-,-,George Washington University,US,2016,"129,356","129,356",115,85,75,89,81,88 (88),67,31,40,29,35,42,4,74,36,0,96,62,31,,"Over the next decade,  the Office for Diversity,  Equity,  and Community Engagement will establish itself as a resource for diversity expertise and help GW become internationally renowned for inclusive excellence. GW's vision for excellence includes transforming itself and higher education by attracting,  retaining and leveraging the talents of diverse individuals to facilitate first-rate teaching,  learning,  scholarship and service in a climate that is welcoming and inclusive.",66,Y,Y,Y,N,N,N,Y,N,Y,Y,"The Office for Diversity,  Equity,  and Community Engagement supports GW’s strategic priorities and aspirations for academic excellence by providing diversity expertise,  tools,  data and programming that inform and shape curricular,  research,  administrative and outreach activities to: improve teaching and learning outcomes; facilitate mentoring and leadership development; increase the dissemination and application of knowledge; and build and sustain vital community partnerships.",60,N,Y,Y,Y,N,Y,Y,Y,N,Y,Y,Y,Y,Y,Y,Y,Y,"Collaboration,  Respect,  Openness,  innovation,  and Diversity ",6,https://diversity.gwu.edu/vision-and-mission,
71,77,61,70,Mannheim Business School,Germany,2020,"124,415","124,415",83,9,67,87,91,98 (87),61,28,21,60,23,89,0,11,68,0,100,72,33,,"Holding a top position in Germany is an honor and an obligation at the same time. For the future,  our vision is to be among the top business schools in Europe and to hold a respective position internationally. Our research shall have a growing impact on practice and on academic literature. We will bring forth leaders with a global outreach,  who will use their potential to engage with businesses and society to make a valuable difference.",76,Y,Y,Y,Y,N,Y,Y,Y,Y,Y,Serves the Business School of the University of Mannheim and therefore also Mannheim Business School as a guiding principle for our work.,22,N,N,Y,N,N,N,N,N,N,N,Y,Y,N,N,N,Y,Y,"Academic excellence as well as rigor and relevance in research,  thought leadership innovation,  critical thinking,  diversity,  integrity,  accountability,  responsibility,  and transparency. ",21,https://www.mannheim-business-school.com/en/the-school/mission-vision-values-and-goals/mission-statement/,
72,84,68,75,Ohio State University: Fisher,US,2020,"137,172","137,172",134,29,97,86,71,93 (99),63,31,36,26,22,23,4,90,65,0,67,32,28,,"The Ohio State University is the model 21st-century public,  land grant,  research,  urban,  community engaged institution. To be the world’s leader in connecting leadership research to experiential leader development and practical solutions to leadership problems.

",35,Y,Y,Y,Y,N,Y,N,N,N,Y,"Creating and discovering knowledge to improve the well-being of our state,  regional,  national and global communities,  ducting students through a comprehensive array of distinguished academic programs,  preparing a diverse student body to be leaders and engaged citizens and fostering a culture of engagement and service.

",45,Y,Y,N,Y,N,Y,Y,Y,Y,Y,Y,Y,N,Y,Y,Y,Y,"Excellence,  diversity in people and of ideas,  inclusion,  access and affordability,  innovation,  collaboration and multidisciplinary endeavor,  Integrity,  transparency and trust. ",20,https://oaa.osu.edu/mission-vision-values-and-core-goals,
73,72,55,67,University of Maryland: Smith,US,2020,"131,642","131,642",117,67,93,88,43,88 (99),79,35,35,32,27,41,9,89,88,0,87,31,84,,,0,,,,,,,,,,,"Create knowledge,  promote an inclusive learning environment that fosters intellectual discovery,  and equip current and future leaders to assess complex problems and deliver innovative solutions. ",25,N,N,N,N,Y,Y,Y,Y,N,Y,Y,Y,N,Y,Y,Y,N,"We do the right things,  the right way. We embrace challenges and opportunities.
We have a collective passion for excellence.",19,https://www.rhsmith.umd.edu/about-us/mission-values,
74,92,91,86,SMU: Cox,US,2016,"134,659","134,659",105,70,30,90,44,89 (95),65,29,34,11,42,35,5,93,37,0,92,79,65,,,0,,,,,,,,,,,"Southern Methodist University will create,  expand,  and impart knowledge through teaching,  research,  and service,  shaping world changers who contribute to their communities and excel in their professions in a global society.",31,Y,Y,N,Y,Y,N,Y,Y,Y,Y,Y,Y,Y,Y,N,Y,Y,Excellence. Integrity. Intellectual freedom. Open dialogue. Diversity and Inclusion,9,https://www.smu.edu/AboutSMU/Mission,
74,73,82,76,University of Pittsburgh: Katz,US,2020,"116,559","116,559",139,36,95,88,67,91 (100),97,32,29,19,23,42,12,56,86,0,89,55,11,,Our aspiration is to be a recognized global leader in the creation and sharing of business knowledge and skills that generate lasting societal value.,24,Y,Y,Y,Y,Y,Y,Y,N,N,N,to produce knowledge through research on issues relevant to business and society; prepare students to create business value through thought leadership and practice; and promote global dialogue on economic and entrepreneurial activities that improve society.,35,Y,Y,N,N,Y,N,Y,Y,N,Y,Y,Y,Y,Y,N,Y,Y,"Candor and Transparency,  which ensure effective communication. Initiative,  which empowers us to take action and perform to the highest standards. Integrity,  which will be demonstrated in our actions and decisions. Collaboration and Compassion,  which emphasize respect and sharing,  and magnify our teamwork Innovation,  which allows us to envision the future and drive change; and Continuous Improvement,  which will be woven into the fabric of what we do.",67,"https://cba.pitt.edu/why-pitt-business/mission-of-pitt-business/#:~:text=Katz%20Graduate%20School%20of%20Business, economic%20and%20entrepreneurial%20activities%20that",
76,83,83,81,University of Rochester: Simon,US,2016,"128,405","128,405",140,49,36,86,82,91 (95),92,20,42,7,37,43,13,34,82,0,75,69,98,,"As a part of the University of Rochester community,  our character is defined by “Meliora”: a relentless endeavor to be ever better in the ideas we bring to the world,  in the opportunities we offer our students,  and in our commitment to inclusiveness.",43,Y,Y,N,Y,Y,Y,N,N,N,N,"To develop business leaders who have an exceptional level of clarity about business and about themselves. We achieve this through research and teaching focused on analytics and economics,  and by being home to a tight-knit community that is among the most diverse of any business school.",46,Y,Y,N,Y,N,N,N,Y,N,Y,Y,Y,N,Y,N,Y,N,Seek clarity. Invest in relationships. Embrace diversity. Make an impact.,10,"https://simon.rochester.edu/why-simon/mission-vision-principles#:~:text=Our%20Mission, diverse%20of%20any%20business%20school",
77,-,84,-,University of Connecticut School of Business,US,2018,"134,093","134,093",114,20,70,88,65,70 (98),100,28,34,28,32,55,0,52,99,0,83,61,46,,"To be a sustainable business school at a public research university,  recognized nationally for innovative research and teaching excellence,  and recognized locally for student and faculty engagement with business and community partners. Our longstanding traditions provide the foundation to achieve this vision,  and our strategic plan delineates our goals for achieving continuous improvement on each element of it.",57,Y,Y,N,Y,N,Y,Y,Y,Y,Y,"As part of a research-focused public university,  the UConn School of Business has a mandate to engage our faculty,  staff,  students,  alumni,  and community partners in activities to transform lives and the surrounding world,  including:

Educating the next generation of business professionals
Discovering the next generation of business insights
Attracting the next generation of business talent
Supporting the next generation of Connecticut businesses
In fulfilling this broad mandate,  we emphasize activities that feature innovative thinking and community engagement.",73,Y,Y,Y,N,Y,Y,N,Y,Y,N,Y,Y,Y,Y,N,N,N,"1. Treat everyone with respect. Praise in public; criticism in private (in person,  constructive).
2. Be bold but responsible with risk — learning and leading require experimentation and sometimes failure. Try to make new mistakes.
3. Support a culture of reporting at all levels. If you know something wrong and don’t report it through our channels,  then the University knew and did nothing. And that’s not acceptable to any of us.4. Assume goodwill.5. Foster all forms of diversity,  including intellectual.6. Embrace dissent.7. Practice consultative and transparent decision making.8. Strive to do the right thing,  especially when it’s hard. In deciding right vs. right,  be guided by our highest values (truth,  excellence,  fairness,  and respect) and our Mission (benefitting students,  then the state and society at large).",124,https://www.business.uconn.edu/about/,
78,81,85,81,University of Minnesota: Carlson,US,2019,"133,274","133,274",93,58,65,89,23,88 (100),69,28,38,30,23,18,16,92,74,0,79,20,47,,,0,,,,,,,,,,,"The University of Minnesota (University),  founded in the belief that all people are enriched by understanding,  is dedicated to the advancement of learning and the search for truth; to the sharing of this knowledge through education for a diverse community; and to the application of this knowledge to benefit the people of the state,  the nation,  and the world.",59,Y,Y,Y,N,N,Y,N,Y,N,Y,Y,Y,Y,Y,N,Y,Y,,0,https://regents.umn.edu/sites/regents.umn.edu/files/2019-09/policy_mission_statement.pdf,
79,80,99,86,EMLyon Business School,France,2015,"96,290","96,290",81,35,40,85,70,91 (97),80,36,42,38,56,88,85,17,12,0,100,83,17,,,0,,,,,,,,,,,"We develop people’s skills for them to achieve personal and professional fulfilment throughout their lives,  by being influential within responsible,  competitive organisations,  wherever they are in the world. That means providing courses that are customisable in time and space,  and harnessing our ability to connect ecosystems.",41,Y,N,N,N,N,Y,Y,N,N,N,Y,Y,Y,Y,Y,N,N,,0,https://www.em-lyon.com/en/Early-Makers/Folder/Our-mission-employability,
80,61,66,69,Melbourne Business School,Australia,2016,"115,679","115,679",74,7,72,89,29,79 (100),55,29,33,19,72,75,25,25,48,0,96,77,64,,"We unleash ideas and leaders for a sustainable future.
This purpose informs how we teach emerging leaders,  who measure success by the impact they have on the people around them and the broader community.

Our hope is that these leaders will create and protect economic growth,  social equality,  shared prosperity and environmental resources for the benefit of all.

We turn to this purpose,  as well as our Guiding Principles,  when making important decisions about how we do business.",75,N,Y,N,Y,N,Y,N,Y,Y,Y,,0,,,,,,,,,,,,,,,,,,"Be Respectful

Act with Integrity

Be Accountable

Strive for Excellence
 
Promote Diversity

Work Collaboratively

Encourage Experimentation
",11,https://mbs.edu/about-us,
81,96,93,90,University of Texas at Dallas: Jindal,US,2018,"111,606","111,606",104,23,100,90,78,92 (100),93,27,48,13,49,36,6,47,98,0,81,17,63,,,0,,,,,,,,,,,"The Jindal School of Management’s mission is to meet the challenges of a rapidly changing,  technology-driven,  global society by partnering with the business community to: 1)Conduct research enhancing management knowledge 2)Deliver high-quality management education to a diverse group of undergraduate and graduate students and practicing executives 3)Develop,  innovate and continuously improve programs advancing management education and practice.",57,Y,Y,N,N,Y,Y,Y,Y,N,Y,Y,Y,Y,Y,N,Y,Y,,0,https://jindal.utdallas.edu/about-the-jindal-school-of-management/,
81,79,88,83,ESMT Berlin,Germany,2016,"116,933","116,933",64,12,91,87,83,80 (94),72,14,27,25,68,92,50,4,59,1,100,74,15,, ,0,,,,,,,,,,,"From the heart of Europe,  we create and impart new knowledge to advance business and society. We develop entrepreneurial leaders who think globally and act responsibly.",26,Y,Y,Y,N,Y,Y,Y,Y,N,Y,Y,Y,Y,Y,N,Y,Y,"Community,  curiosity,  courage,  and rigor",5,https://esmt.berlin/about,
83,78,68,76,Brigham Young University: Marriott,US,2020,"134,907","135,649",136,5,68,88,62,93 (100),45,11,21,8,1,12,2,98,96,0,89,63,30,,,0,,,,,,,,,,,"Attract,  develop,  place,  and continue to engage men and women of faith,  character,  and professional ability who will become outstanding leaders and positively influence a world we wish to improve.",30,Y,N,N,N,N,Y,Y,Y,N,Y,Y,Y,Y,N,N,Y,Y,,0,https://marriottschool.byu.edu/our-story/mission/,
84,86,80,83,The Lisbon MBA Católica | Nova,Portugal,2019,"105,394","105,394",74,42,39,85,77,91 (100),82,37,29,40,31,55,0,22,1,0,100,88,78,,,0,,,,,,,,,,,To make a positive impact in business and society. ,9,N,N,N,N,N,Y,N,N,N,Y,Y,Y,Y,Y,N,Y,Y,,0,https://thelisbonmba.com/,
85,75,55,72,Purdue University: Krannert,US,2015,"119,908","119,908",117,56,86,86,63,77 (98),77,22,24,28,36,57,3,41,80,0,90,46,99,,To be globally recognized and at the forefront of innovation in higher education for empowering students and creating a seamless transition for all.,23,Y,Y,Y,Y,Y,Y,Y,N,N,Y,"To introduce and connect all new undergraduate students to Purdue University through student and staff led academic and social programming,  both on campus and virtual,  in order to prepare them for their Purdue experience.

",34,Y,Y,Y,Y,Y,N,N,Y,Y,Y,Y,N,Y,Y,N,Y,Y,,0,https://www.purdue.edu/orientation/about/report.html ,
86,99,-,-,Texas A & M University: Mays,US,2020,"132,598","132,598",110,10,82,85,92,85 (98),54,31,33,15,20,15,0,76,100,0,78,34,79,,"Mays Business School’s vision is to advance the world’s prosperity. To advance the world’s prosperity means providing a better future for generations who follow,  including quality of life,  environment and economic systems.",32,N,Y,Y,Y,Y,Y,Y,Y,Y,Y,to be a vibrant learning organization that creat impactful knowledge and devoleps transformational leaders ,14,N,N,N,N,Y,N,N,N,N,Y,Y,Y,N,Y,N,N,Y,"Mays students are committed to Texas A&M’s core values of excellence,  integrity,  leadership,  loyalty,  respect and selfless service. These values serve as a platform from which students can launch into their careers and continually return to these basics that help them succeed not only professionally but also personally.",48,https://mays.tamu.edu/10-reasons-why-you-should-step-up-to-a-mays-bba/ https://mays.tamu.edu/mission-statement/,
87,94,90,90,Western University: Ivey,Canada,2018,"109,750","109,390",85,47,56,88,41,89 (95),39,24,33,19,55,50,26,77,54,0,99,57,26,,,0,,,,,,,,,,,"To develop business leaders who think globally,  act strategically,  and contribute to the societies in which they operate.",18,N,N,Y,N,Y,N,N,Y,N,Y,Y,Y,N,Y,N,Y,Y,"Ivey is committed to making a meaningful difference in addressing discrimination,  racism,  and inequality. For details of on our renewed commitment,  including actions and how to get involve",28,https://www.ivey.uwo.ca/about/life-at-ivey/mission-values/,
88,70,63,74,AGSM at UNSW Business School,Australia,2016,"106,393","106,393",62,65,92,85,80,78 (85),61,39,51,50,80,87,50,6,22,0,96,68,52,,,0,,,,,,,,,,,"Our mission is to be a globally engaged,  high impact and academically rigorous business school that enhances practice through leading edge research.",22,N,Y,Y,N,Y,N,N,Y,N,N,Y,Y,Y,N,N,Y,N,,0,https://www.business.unsw.edu.au/about/business-school/strategy,
88,93,96,92,Essec Business School,France,2018,"109,854","109,854",58,41,47,87,68,74 (51),57,35,68,50,58,98,75,19,13,0,99,85,22,,,0,,,,,,,,,,,"The mission of ESSEC Business School,  a world school with French roots,  is to infuse leadership with meaning in order to prepare leaders ready to address contemporary economic,  environmental and social challenges. In order to do so,  it produces innovative and relevant knowledge to equip the next generation of leaders with the skills,  know-how and savoir-être that will make them truly responsible,  inclusive and respectful of the environment. Convinced that knowledge provides a path to freedom - Per scientiam ad libertatem - ESSEC inculcates in its students critical thinking and creativity skills that prepare them to anticipate and address the challenges of an increasingly uncertain world. ESSEC supports students in making their actions both meaningful and impactful by relying on both technology and people. It also seeks to enlighten the actions of businesses and organizations in a world transformed by the new industrial revolution,  the environmental crisis,  a new world balance and other major societal changes.",156,Y,Y,Y,Y,Y,Y,Y,Y,N,Y,N,Y,Y,Y,Y,Y,Y,"The ESSEC emblem,  bearing the motto “Per scientiam ad libertatem, ”  reflects the quest for excellence,  the power of knowledge,  and the willingness to take risks – values that are fundamental to the ESSEC community.This is also the core of ESSEC’s educational model: to give our students an ever greater independence through the dissemination of knowledge.",56,https://www.essec.edu/en/pages/about-essec/values/mission/,
